{"id": "22994d3a-748c-4977-a8dc-0725eea8ff0b", "data": {"mode": "sandbox", "status": "ACTIVE", "revision": 1, "profile_id": "012c2261-5fe8-4917-bbf7-b163e53fe291", "aggregate_version": 4}, "time": "2026-10-17T12:00:00Z", "type": "vn.omama.traceability.profile.published.v1", "source": "https://omama.vn/services/traceability-service", "subject": "profile:012c2261-5fe8-4917-bbf7-b163e53fe291", "specversion": "1.0", "traceparent": "00-2d69d5abb1ddec74a92ccac0b0b351ce-749c3e64ba9960c4-01", "datacontenttype": "application/json"}